{
  "$schema": "https://raw.githubusercontent.com/odere-pro/claude-agentline/main/schemas/config.schema.json",
  "version": 1,
  "theme": "claude-code-dark",
  "lines": [
    {
      "widgets": [
        {
          "type": "model"
        },
        {
          "type": "thinking-effort"
        },
        {
          "type": "plan"
        },
        {
          "type": "project"
        },
        {
          "type": "git-branch"
        },
        {
          "type": "git-changes"
        },
        {
          "type": "git-ahead-behind"
        }
      ]
    },
    {
      "widgets": [
        {
          "type": "context-percentage"
        },
        {
          "type": "token-speed"
        },
        {
          "type": "tokens",
          "options": {
            "reset": "block"
          }
        },
        {
          "type": "tokens-cached"
        }
      ]
    },
    {
      "widgets": [
        {
          "type": "session-weekly-usage"
        },
        {
          "type": "reset-timer"
        }
      ]
    },
    {
      "widgets": [
        {
          "type": "account-email",
          "options": {
            "mask": "domain"
          }
        },
        {
          "type": "version"
        }
      ]
    }
  ],
  "global": {
    "padding": 1,
    "separator": "|",
    "valueSeparator": "\u00b7",
    "inheritColors": false,
    "bold": false,
    "italic": false,
    "minimalist": false,
    "overrideFg": null,
    "overrideBg": null
  },
  "powerline": {
    "enabled": false,
    "theme": null,
    "caps": {
      "start": "",
      "end": ""
    },
    "autoAlign": false,
    "continueColors": false
  },
  "keymap": {},
  "language": "en",
  "refreshInterval": 5,
  "families": {},
  "translations": {}
}
