{
  "$schema": "https://github.com/odere-pro/claude-agentline/schemas/config.schema.json",
  "version": 1,
  "theme": null,
  "lines": [
    {
      "widgets": [
        {
          "type": "model"
        },
        {
          "type": "git-pr"
        }
      ]
    }
  ],
  "global": {
    "padding": 1,
    "separator": "|",
    "valueSeparator": "\u00b7",
    "inheritColors": false,
    "bold": false,
    "italic": false,
    "minimalist": false,
    "overrideFg": null,
    "overrideBg": null
  },
  "powerline": {
    "enabled": false,
    "theme": null,
    "caps": {
      "start": "",
      "end": ""
    },
    "autoAlign": false,
    "continueColors": false
  },
  "keymap": {}
}
